"WIWWVHRF","journalArticle","2015","Thanapongtharm, Weerapong; Linard, Catherine; Wiriyarat, Witthawat; Chinsorn, Pornpiroon; Kanchanasaka, Budsabong; Xiao, Xiangming; Biradar, Chandrashekhar; Wallace, Robert G; Gilbert, Marius","Spatial characterization of colonies of the flying fox bat, a carrier of Nipah virus in Thailand","BMC Veterinary Research","","1746-6148","10.1186/s12917-015-0390-0","http://www.biomedcentral.com/1746-6148/11/81","","2015-12","2016-10-24 11:48:33","2021-06-29 08:00:06","2016-10-24 11:48:33","","","1","11","","","","","","","","","","en","","","","","CrossRef","","","","","","livestock-diseases; livestock-disease-mapping","","","","","","","","","","","","","","","","","","","","","","","","","","","","","","","","","","","","","","","","","","","","","","",""
"WR3JRV4Q","journalArticle","2011","Tatem, Andrew; Linard, Catherine","Population mapping of poor countries","Nature","","1476-4687","10.1038/474036d","","","2011-06-02","2016-10-24 08:41:32","2016-10-24 08:41:32","","36","","7349","474","","Nature","","","","","","","","ENG","","","","","PubMed","","PMID: 21637242","","","","","Humans; Population Density; Socioeconomic Factors; Demography; Censuses; Developing Countries","","","","","","","","","","","","","","","","","","","","","","","","","","","","","","","","","","","","","","","","","","","","","",""
"NA6JKTZM","journalArticle","2016","Thanapongtharm, Weerapong; Linard, Catherine; Chinson, Pornpiroon; Kasemsuwan, Suwicha; Visser, Marjolein; Gaughan, Andrea E.; Epprech, Michael; Robinson, Timothy P.; Gilbert, Marius","Spatial analysis and characteristics of pig farming in Thailand","BMC Veterinary Research","","1746-6148","10.1186/s12917-016-0849-7","http://bmcvetres.biomedcentral.com/articles/10.1186/s12917-016-0849-7","","2016-12","2016-10-06 14:40:06","2016-10-06 14:40:06","2016-10-06 14:40:06","","","1","12","","","","","","","","","","en","","","","","CrossRef","","","","","","transmission-dynamics-h5n1; map-people-livestock","","","","","","","","","","","","","","","","","","","","","","","","","","","","","","","","","","","","","","","","","","","","","","",""
"F7DT45MK","journalArticle","2010","Lambin, Eric F.; Tran, Annelise; Vanwambeke, Sophie O.; Linard, Catherine; Soti, Valérie","Pathogenic landscapes: Interactions between land, people, disease vectors, and their animal hosts","International Journal of Health Geographics","","1476-072X","10.1186/1476-072X-9-54","http://ij-healthgeographics.biomedcentral.com/articles/10.1186/1476-072X-9-54","Landscape attributes influence spatial variations in disease risk or incidence. We present a review of the key findings from eight case studies that we conducted in Europe and West Africa on the impact of land changes on emerging or re-emerging vector-borne diseases and/or zoonoses. The case studies concern West Nile virus transmission in Senegal, tick-borne encephalitis incidence in Latvia, sandfly abundance in the French Pyrenees, Rift Valley Fever in the Ferlo (Senegal), West Nile Fever and the risk of malaria re-emergence in the Camargue, and rodent-borne Puumala hantavirus and Lyme borreliosis in Belgium. We identified general principles governing landscape epidemiology in these diverse disease systems and geographic regions. We formulated ten propositions that are related to landscape attributes, spatial patterns and habitat connectivity, pathways of pathogen transmission between vectors and hosts, scale issues, land use and ownership, and human behaviour associated with transmission cycles. A static view of the ""pathogenecity"" of landscapes overlays maps of the spatial distribution of vectors and their habitats, animal hosts carrying specific pathogens and their habitat, and susceptible human hosts and their land use. A more dynamic view emphasizing the spatial and temporal interactions between these agents at multiple scales is more appropriate. We also highlight the complementarity of the modelling approaches used in our case studies. Integrated analyses at the landscape scale allows a better understanding of interactions between changes in ecosystems and climate, land use and human behaviour, and the ecology of vectors and animal hosts of infectious agents.","2010-10-27","2016-09-30 09:19:35","2016-09-30 09:19:35","2016-09-30 09:19:35","54","","1","9","","","Pathogenic landscapes","","","","","","","En","2010 Lambin et al; licensee BioMed Central Ltd.","","","","ij-healthgeographics.biomedcentral.com","","","","","","","","","","","","","","","","","","","","","","","","","","","","","","","","","","","","","","","","","","","","","","","","","","","","",""
"JPNRZ6AE","journalArticle","2015","Trovão, Nídia Sequeira; Suchard, Marc A.; Baele, Guy; Gilbert, Marius; Lemey, Philippe","Bayesian inference reveals host-specific contributions to the epidemic expansion of Influenza A H5N1","Molecular Biology and Evolution","","0737-4038, 1537-1719","10.1093/molbev/msv185","http://mbe.oxfordjournals.org/content/early/2015/09/03/molbev.msv185","","2015-09-03","2016-09-30 09:15:41","2016-09-30 09:15:41","2016-09-30 09:15:41","msv185","","","","","Mol Biol Evol","","","","","","","","en","","","","","mbe.oxfordjournals.org","","PMID: 26341298","","","","","","","","","","","","","","","","","","","","","","","","","","","","","","","","","","","","","","","","","","","","","","","","","","",""
"FCWDTSN4","journalArticle","2012","Linard, Catherine; Tatem, Andrew J.","Large-scale spatial population databases in infectious disease research","International Journal of Health Geographics","","1476-072X","10.1186/1476-072X-11-7","http://ij-healthgeographics.biomedcentral.com/articles/10.1186/1476-072X-11-7","Modelling studies on the spatial distribution and spread of infectious diseases are becoming increasingly detailed and sophisticated, with global risk mapping and epidemic modelling studies now popular. Yet, in deriving populations at risk of disease estimates, these spatial models must rely on existing global and regional datasets on population distribution, which are often based on outdated and coarse resolution data. Moreover, a variety of different methods have been used to model population distribution at large spatial scales. In this review we describe the main global gridded population datasets that are freely available for health researchers and compare their construction methods, and highlight the uncertainties inherent in these population datasets. We review their application in past studies on disease risk and dynamics, and discuss how the choice of dataset can affect results. Moreover, we highlight how the lack of contemporary, detailed and reliable data on human population distribution in low income countries is proving a barrier to obtaining accurate large-scale estimates of population at risk and constructing reliable models of disease spread, and suggest research directions required to further reduce these barriers.","2012-03-20","2016-09-30 09:14:47","2016-09-30 09:14:47","2016-09-30 09:14:47","7","","1","11","","","","","","","","","","En","2012 Linard and Tatem; licensee BioMed Central Ltd.","","","","ij-healthgeographics.biomedcentral.com","","","","","","","","","","","","","","","","","","","","","","","","","","","","","","","","","","","","","","","","","","","","","","","","","","","","",""
"ITEEMZPI","journalArticle","2013","Van Boeckel, Thomas P.; Tildesley, Michael J.; Linard, Catherine; Halloy, José; Keeling, Matt J.; Gilbert, Marius","The Nosoi commute: a spatial perspective on the rise of BSL-4 laboratories in cities","arXiv preprint arXiv:1312.3283","","","","http://arxiv.org/abs/1312.3283","","2013","2016-09-30 09:14:10","2016-09-30 09:14:10","2016-09-30 09:14:10","","","","","","","The Nosoi commute","","","","","","","","","","","","Google Scholar","","","","","","","","","","","","","","","","","","","","","","","","","","","","","","","","","","","","","","","","","","","","","","","","","","","","",""
"7UACASUW","journalArticle","2013","Tatem, Andrew J.; Gaughan, Andrea E.; Stevens, Forrest R.; Patel, Nirav N.; Jia, Peng; Pandey, Aman; Linard, Catherine","Quantifying the effects of using detailed spatial demographic data on health metrics: a systematic analysis for the AfriPop, AsiaPop, and AmeriPop projects","The Lancet","","","","http://www.sciencedirect.com/science/article/pii/S0140673613613963","","2013","2016-09-30 09:13:57","2016-09-30 09:13:57","2016-09-30 09:13:57","S142","","","381","","","Quantifying the effects of using detailed spatial demographic data on health metrics","","","","","","","","","","","","Google Scholar","","","","","","","","","","","","","","","","","","","","","","","","","","","","","","","","","","","","","","","","","","","","","","","","","","","","",""
"PUVJGXKJ","journalArticle","2012","Tatem, Andrew J.; Adamo, Susana; Bharti, Nita; Burgert, Clara R.; Castro, Marcia; Dorelien, Audrey; Fink, Gunter; Linard, Catherine; John, Mendelsohn; Montana, Livia; others","Mapping populations at risk: improving spatial demographic data for infectious disease modeling and metric derivation","Population Health Metrics","","","","https://pophealthmetrics.biomedcentral.com/articles/10.1186/1478-7954-10-8","","2012","2016-09-30 09:13:49","2021-06-29 08:16:48","2016-09-30 09:13:49","1","","1","10","","","Mapping populations at risk","","","","","","","","","","","","Google Scholar","","","","","","","","","","","","","","","","","","","","","","","","","","","","","","","","","","","","","","","","","","","","","","","","","","","","",""
"I5GBS77Z","journalArticle","2011","Tatem, Andrew J.; Campiz, Nicholas; Gething, Peter W.; Snow, Robert W.; Linard, Catherine","The effects of spatial population dataset choice on estimates of population at risk of disease","Population Health Metrics","","","","https://pophealthmetrics.biomedcentral.com/articles/10.1186/1478-7954-9-4","","2011","2016-09-30 09:13:39","2021-09-27 13:33:28","","1","","1","9","","","","","","","","","","","","","","","Google Scholar","","","","","","","","","","","","","","","","","","","","","","","","","","","","","","","","","","","","","","","","","","","","","","","","","","","","",""
"G3ZZ5TMM","journalArticle","2015","Stevens, Forrest R.; Gaughan, Andrea E.; Linard, Catherine; Tatem, Andrew J.","Disaggregating census data for population mapping using random forests with remotely-sensed and ancillary data","PLoS One","","1932-6203","10.1371/journal.pone.0107042","http://dx.plos.org/10.1371/journal.pone.0107042","","2015-02-17","2016-09-30 09:13:35","2021-06-29 07:59:55","2016-09-30 09:13:35","e0107042","","2","10","","","","","","","","","","en","","","","","CrossRef","","","","","","","","Amaral, Luís A. Nunes","","","","","","","","","","","","","","","","","","","","","","","","","","","","","","","","","","","","","","","","","","","","",""
"6BP3EVTG","journalArticle","2015","Sorichetta, Alessandro; Hornby, Graeme M.; Stevens, Forrest R.; Gaughan, Andrea E.; Linard, Catherine; Tatem, Andrew J.","High-resolution gridded population datasets for Latin America and the Caribbean in 2010, 2015, and 2020","Scientific Data","","2052-4463","10.1038/sdata.2015.45","http://www.nature.com/articles/sdata201545","","2015-09-01","2016-09-30 09:13:32","2016-09-30 09:13:32","2016-09-30 09:13:32","150045","","","2","","","","","","","","","","","","","","","CrossRef","","","","","","","","","","","","","","","","","","","","","","","","","","","","","","","","","","","","","","","","","","","","","","","","","","","","",""
"459X3DSV","journalArticle","2013","Linard, Catherine; Tatem, Andrew J.; Gilbert, Marius","Modelling spatial patterns of urban growth in Africa","Applied Geography","","01436228","10.1016/j.apgeog.2013.07.009","http://linkinghub.elsevier.com/retrieve/pii/S0143622813001707","","2013-10","2016-09-30 09:13:29","2016-09-30 09:13:29","2016-09-30 09:13:29","23-32","","","44","","","","","","","","","","en","","","","","CrossRef","","","","","","mapping-human-pop","","","","","","","","","","","","","","","","","","","","","","","","","","","","","","","","","","","","","","","","","","","","","","",""
"9Q52KRC2","journalArticle","2010","Linard, Catherine; Alegana, Victor A.; Noor, Abdisalan M.; Snow, Robert W.; Tatem, Andrew J.","A high resolution spatial population database of Somalia for disease risk mapping","International Journal of Health Geographics","","","","https://ij-healthgeographics.biomedcentral.com/articles/10.1186/1476-072X-9-45","","2010","2016-09-30 09:13:11","2021-09-27 13:34:14","","1","","1","9","","","","","","","","","","","","","","","Google Scholar","","","","","","","","","","","","","","","","","","","","","","","","","","","","","","","","","","","","","","","","","","","","","","","","","","","","",""
"ZIXZR7M7","journalArticle","2016","Kabaria, Caroline W.; Molteni, Fabrizio; Mandike, Renata; Chacky, Frank; Noor, Abdisalan M.; Snow, Robert W.; Linard, Catherine","Mapping intra-urban malaria risk using high resolution satellite imagery: a case study of Dar es Salaam","International Journal of Health Geographics","","1476-072X","10.1186/s12942-016-0051-y","http://ij-healthgeographics.biomedcentral.com/articles/10.1186/s12942-016-0051-y","","2016-12","2016-09-30 09:12:58","2016-09-30 09:12:58","2016-09-30 09:12:58","","","1","15","","","Mapping intra-urban malaria risk using high resolution satellite imagery","","","","","","","en","","","","","CrossRef","","","","","","","","","","","","","","","","","","","","","","","","","","","","","","","","","","","","","","","","","","","","","","","","","","","","",""
"RHQQW6CX","journalArticle","2012","Houben, Rein MGJ; Van Boeckel, Thomas P.; Mwinuka, Venance; Mzumara, Peter; Branson, Keith; Linard, Catherine; Chimbwandira, Frank; French, Neil; Glynn, Judith R.; Crampin, Amelia C.","Monitoring the impact of decentralised chronic care services on patient travel time in rural Africa-methods and results in Northern Malawi","International Journal of Health Geographics","","","","http://ij-healthgeographics.biomedcentral.com/articles/10.1186/1476-072X-11-49","","2012","2016-09-30 09:12:55","2021-06-29 08:17:22","2016-09-30 09:12:55","1","","1","11","","","","","","","","","","","","","","","Google Scholar","","","","","","","","","","","","","","","","","","","","","","","","","","","","","","","","","","","","","","","","","","","","","","","","","","","","",""
"VIGIFRA3","journalArticle","2015","Gaughan, A.E.; Stevens, F.R.; Linard, C.; Patel, N.N.; Tatem, A.J.","Exploring nationally and regionally defined models for large area population mapping","International Journal of Digital Earth","","1753-8947, 1753-8955","10.1080/17538947.2014.965761","http://www.tandfonline.com/doi/full/10.1080/17538947.2014.965761","","2015-12-02","2016-09-30 09:12:49","2016-09-30 09:12:49","2016-09-30 09:12:49","989-1006","","12","8","","","","","","","","","","en","","","","","CrossRef","","","","","","","","","","","","","","","","","","","","","","","","","","","","","","","","","","","","","","","","","","","","","","","","","","","","",""
"DAK7D9UN","journalArticle","2014","Deville, Pierre; Linard, Catherine; Martin, Samuel; Gilbert, Marius; Stevens, Forrest R.; Gaughan, Andrea E.; Blondel, Vincent D.; Tatem, Andrew J.","Dynamic population mapping using mobile phone data","Proceedings of the National Academy of Sciences, USA","","0027-8424, 1091-6490","10.1073/pnas.1408439111","http://www.pnas.org/lookup/doi/10.1073/pnas.1408439111","","2014-11-11","2016-09-30 09:12:43","2021-06-29 08:15:41","2016-09-30 09:12:43","15888-15893","","45","111","","","","","","","","","","en","","","","","CrossRef","","","","","","mapping-human-pop","","","","","","","","","","","","","","","","","","","","","","","","","","","","","","","","","","","","","","","","","","","","","","",""
"XJQN9WZE","journalArticle","2015","Deleu, Julie; Franke, Jonas; Gebreslasie, Michael; Linard, Catherine","Improving AfriPop dataset with settlement extents extracted from RapidEye for the border region comprising South-Africa, Swaziland and Mozambique","Geospatial Health","","1970-7096, 1827-1987","10.4081/gh.2015.336","http://www.geospatialhealth.net/index.php/gh/article/view/336","","2015-11-04","2016-09-30 09:12:40","2016-09-30 09:12:40","2016-09-30 09:12:40","","","2","10","","","","","","","","","","","","","","","CrossRef","","","","","","","","","","","","","","","","","","","","","","","","","","","","","","","","","","","","","","","","","","","","","","","","","","","","",""
"447S4SKC","journalArticle","2015","Van Boeckel, Thomas P.; Brower, Charles; Gilbert, Marius; Grenfell, Bryan T.; Levin, Simon A.; Robinson, Timothy P.; Teillant, Aude; Laxminarayan, Ramanan","Global trends in antimicrobial use in food animals","Proceedings of the National Academy of Sciences, USA","","0027-8424, 1091-6490","10.1073/pnas.1503141112","http://www.pnas.org/lookup/doi/10.1073/pnas.1503141112","","2015-05-05","2016-09-30 05:22:02","2021-06-29 09:50:42","2016-09-30 05:22:02","5649-5654","","18","112","","","","","","","","","","en","","","","","CrossRef","","","","","","","","","","","","","","","","","","","","","","","","","","","","","","","","","","","","","","","","","","","","","","","","","","","","",""
"BFBNNPA6","journalArticle","2016","Tisseuil, Clément; Gryspeirt, Aiko; Lancelot, Renaud; Pioz, Maryline; Liebhold, Andrew; Gilbert, Marius","Evaluating methods to quantify spatial variation in the velocity of biological invasions","Ecography","","09067590","10.1111/ecog.01393","http://doi.wiley.com/10.1111/ecog.01393","","2016-05","2016-09-30 05:21:53","2016-09-30 05:21:53","2016-09-30 05:21:53","409-418","","5","39","","","","","","","","","","en","","","","","CrossRef","","","","","","modelling-invasions","","","","","","","","","","","","","","","","","","","","","","","","","","","","","","","","","","","","","","","","","","","","","","",""
"HVMSRMQX","journalArticle","2015","Gilbert, Marius; Conchedda, Giulia; Van Boeckel, Thomas P.; Cinardi, Giuseppina; Linard, Catherine; Nicolas, Gaëlle; Thanapongtharm, Weerapong; D'Aietti, Laura; Wint, William; Newman, Scott H.; Robinson, Timothy P.","Income disparities and the global distribution of intensively farmed chicken and pigs","PLoS One","","1932-6203","10.1371/journal.pone.0133381","http://dx.plos.org/10.1371/journal.pone.0133381","","2015-07-31","2016-09-30 05:21:37","2021-06-29 07:59:09","2016-09-30 05:21:37","e0133381","","7","10","","","","","","","","","","en","","","","","CrossRef","","","","","","map-people-livestock; mapping-livestock; livestock-disease-mapping","","Boulinier, Thierry","","","","","","","","","","","","","","","","","","","","","","","","","","","","","","","","","","","","","","","","","","","","",""
"PFJRAVXW","journalArticle","2015","Wallace, Robert G.; Bergmann, Luke; Kock, Richard; Gilbert, Marius; Hogerwerf, Lenny; Wallace, Rodrick; Holmberg, Mollie","The dawn of structural one health: a new science tracking disease emergence along circuits of capital","Social Science and Medicine","","02779536","10.1016/j.socscimed.2014.09.047","http://linkinghub.elsevier.com/retrieve/pii/S0277953614006145","","2015-03","2016-09-30 05:21:28","2021-06-29 08:14:13","2016-09-30 05:21:28","68-77","","","129","","","The dawn of Structural One Health","","","","","","","en","","","","","CrossRef","","","","","","","","","","","","","","","","","","","","","","","","","","","","","","","","","","","","","","","","","","","","","","","","","","","","",""
"G3GMZXV6","journalArticle","2014","Paul, Mathilde C.; Gilbert, Marius; Desvaux, Stéphanie; Rasamoelina Andriamanivo, Harena; Peyre, Marisa; Khong, Nguyen Viet; Thanapongtharm, Weerapong; Chevalier, Véronique","Agro-environmental determinants of avian influenza circulation: a multisite study in Thailand, Vietnam and Madagascar","PLoS One","","1932-6203","10.1371/journal.pone.0101958","http://dx.plos.org/10.1371/journal.pone.0101958","","2014-07-16","2016-09-30 05:21:15","2021-06-29 07:58:21","2016-09-30 05:21:15","e101958","","7","9","","","Agro-Environmental Determinants of Avian Influenza Circulation","","","","","","","en","","","","","CrossRef","","","","","","","","Goldstein, Edward","","","","","","","","","","","","","","","","","","","","","","","","","","","","","","","","","","","","","","","","","","","","",""
"7RQC6VE8","journalArticle","2015","Hartemink, Nienke; Vanwambeke, Sophie O.; Purse, Bethan V.; Gilbert, Marius; Van Dyck, Hans","Towards a resource-based habitat approach for spatial modelling of vector-borne disease risks: Resource-based habitats for vector-borne diseases","Biological Reviews","","14647931","10.1111/brv.12149","http://doi.wiley.com/10.1111/brv.12149","","2015-11","2016-09-30 05:21:09","2016-09-30 05:21:09","2016-09-30 05:21:09","1151-1162","","4","90","","","Towards a resource-based habitat approach for spatial modelling of vector-borne disease risks","","","","","","","en","","","","","CrossRef","","","","","","","","","","","","","","","","","","","","","","","","","","","","","","","","","","","","","","","","","","","","","","","","","","","","",""
"KACMTNG6","journalArticle","2014","Cappelle, Julien; Zhao, Delong; Gilbert, Marius; Nelson, Martha I.; Newman, Scott H.; Takekawa, John Y.; Gaidet, Nicolas; Prosser, Diann J.; Liu, Ying; Li, Peng; Shu, Yuelong; Xiao, Xiangming","Risks of avian influenza transmission in areas of intensive free-ranging duck production with wild waterfowl","EcoHealth","","1612-9202, 1612-9210","10.1007/s10393-014-0914-2","http://link.springer.com/10.1007/s10393-014-0914-2","","2014-03","2016-09-30 05:20:50","2021-06-29 07:57:13","2016-09-30 05:20:50","109-119","","1","11","","","","","","","","","","en","","","","","CrossRef","","","","","","transmission-dynamics-h5n1","","","","","","","","","","","","","","","","","","","","","","","","","","","","","","","","","","","","","","","","","","","","","","",""
"DRG2RQAJ","journalArticle","2013","Thanapongtharm, Weerapong; Van Boeckel, Thomas P.; Biradar, Chandrashekhar; Xiao, Xiangming; Gilbert, Marius","Rivers and flooded areas identified by medium-resolution remote sensing improve risk prediction of the highly pathogenic avian influenza H5N1 in Thailand","Geospatial Health","","","","http://www.ncbi.nlm.nih.gov/pmc/articles/PMC4868045/","","2013","2016-09-30 05:20:40","2021-06-29 08:16:00","2016-09-30 05:20:40","193","","1","8","","","","","","","","","","","","","","","Google Scholar","","","","","","","","","","","","","","","","","","","","","","","","","","","","","","","","","","","","","","","","","","","","","","","","","","","","",""
"56JKP5JQ","journalArticle","2013","Stevens, Kim B.; Gilbert, Marius; Pfeiffer, Dirk U.","Modeling habitat suitability for occurrence of highly pathogenic avian influenza virus H5N1 in domestic poultry in Asia: A spatial multicriteria decision analysis approach","Spatial and Spatiotemporal Epidemiology","","18775845","10.1016/j.sste.2012.11.002","http://linkinghub.elsevier.com/retrieve/pii/S1877584512000834","","2013-03","2016-09-30 05:20:24","2021-06-29 08:16:08","2016-09-30 05:20:24","1-14","","","4","","","Modeling habitat suitability for occurrence of highly pathogenic avian influenza virus H5N1 in domestic poultry in Asia","","","","","","","en","","","","","CrossRef","","","","","","","","","","","","","","","","","","","","","","","","","","","","","","","","","","","","","","","","","","","","","","","","","","","","",""
"NZJFK39H","journalArticle","2013","Mardulyn, Patrick; Goffredo, Maria; Conte, Annamaria; Hendrickx, Guy; Meiswinkel, Rudolf; Balenghien, Thomas; Sghaier, Soufien; Lohr, Youssef; Gilbert, Marius","Climate change and the spread of vector-borne diseases: using approximate Bayesian computation to compare invasion scenarios for the bluetongue virus vector Culicoides imicola in Italy","Molecular Ecology","","09621083","10.1111/mec.12264","http://doi.wiley.com/10.1111/mec.12264","","2013-05","2016-09-30 05:20:20","2021-07-02 11:23:16","2016-09-30 05:20:20","2456-2466","","9","22","","","Climate change and the spread of vector-borne diseases","","","","","","","en","","","","","CrossRef","","","","","","","","","","","","","","","","","","","","","","","","","","","","","","","","","","","","","","","","","","","","","","","","","","","","",""
"WZBGKBG4","journalArticle","2013","Ippoliti, Carla; Gilbert, Marius; Vanhuysse, Sabine; Goffredo, Maria; Satta, Giuseppe; Wolff, Eléonore; Conte, Annamaria","Can landscape metrics help determine the Culicoides imicola distribution in Italy?","Geospatial Health","","","","http://eprints.bice.rm.cnr.it/9438/","","2013","2016-09-30 05:20:09","2021-07-02 11:20:32","2016-09-30 05:20:09","267–277","","1","8","","","","","","","","","","","","","","","Google Scholar","","","","","","","","","","","","","","","","","","","","","","","","","","","","","","","","","","","","","","","","","","","","","","","","","","","","",""
"SWZ9CZI4","journalArticle","2013","Fuller, Trevon L.; Gilbert, Marius; Martin, Vincent; Cappelle, Julien; Hosseini, Parviez; Njabo, Kevin Y.; Abdel Aziz, Soad; Xiao, Xiangming; Daszak, Peter; Smith, Thomas B.","Predicting hotspots for influenza virus reassortment","Emerging Infectious Diseases","","1080-6040, 1080-6059","10.3201/eid1904.120903","http://wwwnc.cdc.gov/eid/article/19/4/12-0903_article.htm","","2013-04","2016-09-30 05:20:05","2021-06-29 07:56:05","2016-09-30 05:20:05","581-588","","4","19","","","","","","","","","","","","","","","CrossRef","","","","","","","","","","","","","","","","","","","","","","","","","","","","","","","","","","","","","","","","","","","","","","","","","","","","",""
