"D4KEQQGU","journalArticle","2003","Hougardy, E.; Pernet, P.; Warnau, M.; Delisle, J.; Grégoire, J.-C.","Marking bark beetle parasitoids within the host plant with rubidium for dispersal studies","Entomologia Experimentalis et Applicata","","1570-7458","10.1046/j.1570-7458.2003.00073.x","http://dx.doi.org/10.1046/j.1570-7458.2003.00073.x","A technique using rubidium chloride (RbCl), a trace element, as internal label is proposed for marking hymenopteran parasitoids attacking a concealed host, Ips typographus L. (Coleoptera: Scolytidae). RbCl was introduced directly into spruce via the vascular system using glass tubing. RbCl passed through the food chain and was detected at the parasitoid level by electrothermal atomic absorption spectroscopy (EAAS) or flame emission spectroscopy (FES). Mark persistency until day 8 after emergence was tested in labelled Rhopalicus tutela (Walker) (Hymenoptera: Pteromalidae). The mark decreased with time only in fed females, probably due to excretion and/or egg resorption. The proportion of marked males did not vary with time or treatment.","2003-08-01","2018-01-19 09:45:29","2018-01-19 09:45:29","","107-114","","2","108","","","","","","","","","","","","","","","","","","","","","Braconidae; Hymenoptera; Coleoptera; Ips typographus; Scolytidae; Coeloides bostrichorum; EAAS; FES; mark-capture; Pteromalidae; Rhopalicus tutela; tree infusion","","","","","","","","","","","","","","","","","","","","","","","","","","","","","","","","","","","","","","","","","","","","","","",""
"SEGR2PMI","journalArticle","2004","Hougardy, E.; Grégoire, J.-C.","Biological differences reflect host preference in two parasitoids attacking the bark beetle Ips typographus (Coleoptera: Scolytidae) in Belgium","Bulletin of Entomological Research","","0007-4853","10.1079/BER2004305","https://www.cambridge.org/core/article/biological-differences-reflect-host-preference-in-two-parasitoids-attacking-the-bark-beetle-ips-typographus-coleoptera-scolytidae-in-belgium/C8E31F58E36E391CA6CB964DA24891EB","AbstractThe basic reproductive biology of two ectoparasitoids developing on the late larval instars of the scolytid Ips typographus Linnaeus, a pest of spruce forests in Eurasia, was studied with the purpose of explaining which biological features allow the two species to share the same host. The anautogenous braconid Coeloides bostrichorum Giraud had a longer pre-oviposition period (5.1 vs. 3.3 days), a greater egg load (8.1 vs. 6.1 eggs), survived longer and emerged later than the pteromalid Rhopalicus tutela (Walker). In contrast, R. tutela was autogenous and tended to be more fecund under constrained conditions (9.7 vs. 5.1 total offspring per female). The longer pre-oviposition period of the specialist C. bostrichorum, coupled with its greater longevity, afforded the opportunity of better synchronization of ovipositing females with late instar larvae of I. typographus. By contrast, the polyphagous R. tutela matured rapidly, allowing parasitism of both younger and older larval instars of I. typographus in addition to other species. These small differences favoured the co-occurrence of the two parasitoid species on the same attacked trees.","2004","2018-01-19 09:45:23","2021-07-02 11:30:07","","341-347","","4","94","","","","","","","","","","","","","Cambridge Core","","Cambridge University Press","","","","","","","","","","","","","","","","","","","","","","","","","","","","","","","","","","","","","","","","","","","","","","","","","","","","",""
"RA4K9AGJ","journalArticle","2003","Hougardy, Evelyne; Grégoire, Jean-Claude","Cleptoparasitism increases the host finding ability of a polyphagous parasitoid species, Rhopalicus tutela (Hymenoptera: Pteromalidae)","Behavioral Ecology and Sociobiology","","1432-0762","10.1007/s00265-003-0688-y","https://doi.org/10.1007/s00265-003-0688-y","Host finding abilities were investigated in the braconid Coeloides bostrichorum and the pteromalid Rhopalicus tutela, two ectoparasitoid wasps attacking the late instar of the bark beetle Ips typographus. Under laboratory conditions, important differences in the host-searching behaviour of these species were found, R. tutela being highly mobile as compared to C. bostrichorum. In the presence of C. bostrichorum, R. tutela behaved as a cleptoparasitoid, displacing the females from their oviposition sites and stealing the hosts previously located by the braconid. This behaviour facilitated host finding in R. tutela and could partly explain the relative success of the polyphagous R. tutela when occurring with the more specialised C. bostrichorum.","2003-12-01","2018-01-19 09:45:18","2021-07-02 11:20:26","","184-189","","2","55","","Behavioral Ecology and Sociobiology","","","","","","","","","","","","","","","","","","","","","","","","","","","","","","","","","","","","","","","","","","","","","","","","","","","","","","","","","","","","","","","","","",""
"MBZAU85L","journalArticle","2001","Hougardy, Evelyne; Grégoire, Jean-Claude","Bark-beetle parasitoids population surveys following storm damage in spruce stands in the Vosges region (France)","Integrated Pest Management Reviews","","","","https://link.springer.com/article/10.1023/A:1025727503264","","2001","2018-01-19 09:45:14","2021-06-29 09:55:59","","163-168","","3-4","6","","","","","","","","","","","","","","","","","","","","","","","Grégoire, Jean-Claude; Stephen, Fredrick; Salom, Scott","","","","","","","","","","","","","","","","","","","","","","","","","","","","","","","","","","","","","","","","","","","","",""
"A93CLTUQ","journalArticle","2000","Hougardy, E.; Grégoire, J.-C.","Spruce stands provide natural food sources to adult hymenopteran parasitoids of bark beetles","Entomologia Experimentalis et Applicata","","1570-7458","10.1046/j.1570-7458.2000.00704.x","http://dx.doi.org/10.1046/j.1570-7458.2000.00704.x","Adults of synovigenic hymenopteran parasitoids of bark beetles need supplemental feeding to maximise their lifetime realised fecundity, and yet little is known about the natural sources that provide this food. Here we show that, in spite of the reduced diversity of flowering plants expected in even-aged spruce plantations, several plant species are present that might provide nectar and pollen to the hymenopteran parasitoid complex of Ips typographus L. (Coleoptera: Scolytidae), throughout the growing season. Conifer aphids are also abundant in these stands and produce large amounts of honeydew, which might also be consumed by the parasitoids. Laboratory experiments demonstrate that longevity is significantly increased in Coeloides bostrychorum Giraud (Hymenoptera: Braconidae) when the wasps are exposed to flowers of various species commonly found in spruce stands.","2000-09-01","2018-01-19 09:45:10","2018-01-19 09:45:10","","253-263","","3","96","","","","","","","","","","","","","","","","","","","","","bark beetles; Ips typographus; Scolytidae; adult feeding; Coeloides bostrychorum; natural enemies; natural food resources; parasitoids","","","","","","","","","","","","","","","","","","","","","","","","","","","","","","","","","","","","","","","","","","","","","","",""
"8FCD6GBN","journalArticle","2018","Hill, Edward M.; House, Thomas; Dhingra, Madhur S.; Kalpravidh, Wantanee; Morzaria, Subhash; Osmani, Muzaffar G.; Brum, Eric; Yamage, Mat; Kalam, Md A.; Prosser, Diann J.; Takekawa, John Y.; Xiao, Xiangming; Gilbert, Marius; Tildesley, Michael J.","The impact of surveillance and control on highly pathogenic avian influenza outbreaks in poultry in Dhaka division, Bangladesh","PLoS Computational Biology","","1553-7358","10.1371/journal.pcbi.1006439","https://journals.plos.org/ploscompbiol/article?id=10.1371/journal.pcbi.1006439","In Bangladesh, the poultry industry is an economically and socially important sector, but it is persistently threatened by the effects of H5N1 highly pathogenic avian influenza. Thus, identifying the optimal control policy in response to an emerging disease outbreak is a key challenge for policy-makers. To inform this aim, a common approach is to carry out simulation studies comparing plausible strategies, while accounting for known capacity restrictions. In this study we perform simulations of a previously developed H5N1 influenza transmission model framework, fitted to two separate historical outbreaks, to assess specific control objectives related to the burden or duration of H5N1 outbreaks among poultry farms in the Dhaka division of Bangladesh. In particular, we explore the optimal implementation of ring culling, ring vaccination and active surveillance measures when presuming disease transmission predominately occurs from premises-to-premises, versus a setting requiring the inclusion of external factors. Additionally, we determine the sensitivity of the management actions under consideration to differing levels of capacity constraints and outbreaks with disparate transmission dynamics. While we find that reactive culling and vaccination policies should pay close attention to these factors to ensure intervention targeting is optimised, across multiple settings the top performing control action amongst those under consideration were targeted proactive surveillance schemes. Our findings may advise the type of control measure, plus its intensity, that could potentially be applied in the event of a developing outbreak of H5N1 amongst originally H5N1 virus-free commercially-reared poultry in the Dhaka division of Bangladesh.","2018-09-13","2018-10-10 09:27:23","2021-06-29 08:12:56","2018-10-10 09:27:23","e1006439","","9","14","","","","","","","","","","en","","","","","PLoS Journals","","","","","","","Epidemiology; Bangladesh; H5N1; Poultry; Livestock; Infectious disease control; Infectious disease surveillance; Vaccination and immunization","","","","","","","","","","","","","","","","","","","","","","","","","","","","","","","","","","","","","","","","","","","","","",""
"NAA5FB5U","journalArticle","2018","Dhingra, Madhur S.; Artois, Jean; Dellicour, Simon; Lemey, Philippe; Dauphin, Gwenaelle; Von Dobschuetz, Sophie; Van Boeckel, Thomas P.; Castellan, David M.; Morzaria, Subhash; Gilbert, Marius","Geographical and historical patterns in the emergences of novel highly pathogenic avian influenza (HPAI) H5 and H7 viruses in poultry","Frontiers in Veterinary Science","","","","http://www.frontiersin.org/articles/10.3389/fvets.2018.00084/full","","2018","2018-10-02 12:05:03","2018-10-03 09:04:35","","","","84","5","","","","","","","","","","","All rights reserved","","","","","","","","","","Reassortment; Low pathogenic to highly pathogenic conversion; Novel HPAI emergences; phylogeography.; spatialand temporal pattern","","","","","","","","","","","","","","","","","","","","","","","","","","","","","","","","","","","","","","","","","","","","","","",""
"CAWBBU8B","journalArticle","2021","Elizondo, Victoria; Harkins, Gordon W.; Mabvakure, Batsirai; Smidt, Sabine; Zappile, Paul; Marier, Christian; Maurano, Matthew T.; Perez, Victoria; Mazza, Natalia; Beloso, Carolina; Ifran, Silvana; Fernandez, Mariana; Santini, Andrea; Perez, Veronica; Estevez, Veronica; Nin, Matilde; Manrique, Gonzalo; Perez, Leticia; Ross, Fabiana; Boschi, Susana; Zubillaga, Maria Noel; Balleste, Raquel; Dellicour, Simon; Heguy, Adriana; Duerr, Ralf","SARS-CoV-2 genomic characterization and clinical manifestation of the COVID-19 outbreak in Uruguay","Emerging Microbes & Infections","","2222-1751","10.1080/22221751.2020.1863747","https://www.tandfonline.com/doi/full/10.1080/22221751.2020.1863747","COVID-19 is a respiratory illness caused by severe acute respiratory syndrome coronavirus 2 (SARS-CoV-2) and declared by the World Health Organization a global public health emergency. Among the severe outbreaks across South America, Uruguay has become known for curtailing SARS-CoV-2 exceptionally well. To understand the SARS-CoV-2 introductions, local transmissions, and associations with genomic and clinical parameters in Uruguay, we sequenced the viral genomes of 44 outpatients and inpatients in a private healthcare system in its capital, Montevideo, from March to May 2020. We performed a phylogeographic analysis using sequences from our cohort and other studies that indicate a minimum of 23 independent introductions into Uruguay, resulting in ﬁve major transmission clusters. Our data suggest that most introductions resulting in chains of transmission originate from other South American countries, with the earliest seeding of the virus in late February 2020, weeks before the borders were closed to all non-citizens and a partial lockdown implemented. Genetic analyses suggest a dominance of S and G clades (G, GH, GR) that make up >90% of the viral strains in our study. In our cohort, lethal outcome of SARS-CoV-2 infection signiﬁcantly correlated with arterial hypertension, kidney failure, and ICU admission (FDR < 0.01), but not with any mutation in a structural or nonstructural protein, such as the spike D614G mutation. Our study contributes genetic, phylodynamic, and clinical correlation data about the exceptionally well-curbed SARS-CoV-2 outbreak in Uruguay, which furthers the understanding of disease patterns and regional aspects of the pandemic in Latin America.","2021-01-01","2021-01-30 15:53:24","2021-01-30 15:53:24","2021-01-30 15:52:08","51-65","","1","10","","Emerging Microbes & Infections","","","","","","","","en","All rights reserved","","","","DOI.org (Crossref)","","","","","","","","","","","","","","","","","","","","","","","","","","","","","","","","","","","","","","","","","","","","","","","","","","","","",""
"GKKM2WHQ","journalArticle","2021","Fountain-Jones, Nicholas M.; Kraberger, Simona; Gagne, Roderick B.; Trumbo, Daryl R.; Salerno, Patricia E.; Chris Funk, W.; Crooks, Kevin; Biek, Roman; Alldredge, Mathew; Logan, Ken; Baele, Guy; Dellicour, Simon; Ernest, Holly B.; VandeWoude, Sue; Carver, Scott; Craft, Meggan E.","Host relatedness and landscape connectivity shape pathogen spread in the puma, a large secretive carnivore","Communications Biology","","2399-3642","10.1038/s42003-020-01548-2","https://www.nature.com/articles/s42003-020-01548-2","Urban expansion can fundamentally alter wildlife movement and gene flow, but how urbanization alters pathogen spread is poorly understood. Here, we combine high resolution host and viral genomic data with landscape variables to examine the context of viral spread in puma (Puma concolor) from two contrasting regions: one bounded by the wildland urban interface (WUI) and one unbounded with minimal anthropogenic development (UB). We found landscape variables and host gene flow explained significant amounts of variation of feline immunodeficiency virus (FIV) spread in the WUI, but not in the unbounded region. The most important predictors of viral spread also differed; host spatial proximity, host relatedness, and mountain ranges played a role in FIV spread in the WUI, whereas roads might have facilitated viral spread in the unbounded region. Our research demonstrates how anthropogenic landscapes can alter pathogen spread, providing a more nuanced understanding of host-pathogen relationships to inform disease ecology in free-ranging species.","2021-01-04","2021-01-30 14:35:40","2021-01-30 14:36:08","2021-01-30 14:35:40","1-9","","1","4","","Commun. Biol.","","","","","","","","en","2021 The Author(s)","","","","www.nature.com","","Number: 1 Publisher: Nature Publishing Group","","","","","","","","","","","","","","","","","","","","","","","","","","","","","","","","","","","","","","","","","","","","","","","","","","",""
"DTV8EXKW","journalArticle","2020","Schar, Daniel; Klein, Eili Y.; Laxminarayan, Ramanan; Gilbert, Marius; Van Boeckel, Thomas P.","Global trends in antimicrobial use in aquaculture","Scientific Reports","","2045-2322","10.1038/s41598-020-78849-3","https://www.nature.com/articles/s41598-020-78849-3","Globally aquaculture contributes 8% of animal protein intake to the human diet, and per capita consumption is increasing faster than meat and dairy consumption. Reports have documented antimicrobial use in the rapidly expanding aquaculture industry, which may contribute to the rise of antimicrobial resistance, carrying potential consequences for animal-, human-, and ecosystem-health. However, quantitative antimicrobial use across a highly diversified aquaculture industry is not well characterized. Here, we estimate global trends in antimicrobial use in aquaculture in 2017 and 2030 to help target future surveillance efforts and antimicrobial stewardship policies. We estimate antimicrobial use intensity (mg kg−1) for six species groups though a systematic review of point prevalence surveys, which identified 146 species-specific antimicrobial use rates. We project antimicrobial use in each country by combining mean antimicrobial use coefficients per species group with OECD/FAO Agricultural Outlook and FAO FishStat production volumes. We estimate global antimicrobial consumption in 2017 at 10,259 tons (95% uncertainty interval [UI] 3163–44,727 tons), increasing 33% to 13,600 tons in 2030 (UI 4193–59,295). The Asia–Pacific region represents the largest share (93.8%) of global consumption, with China alone contributing 57.9% of global consumption in 2017. Antimicrobial consumption intensity per species group was: catfish, 157 mg kg−1 (UI 9–2751); trout, 103 mg kg−1 (UI 5–1951); tilapia, 59 mg kg−1 (UI 21–169); shrimp, 46 mg kg−1 (UI 10–224); salmon, 27 mg kg−1 (UI 17–41) and a pooled species group, 208 mg kg−1, (UI 70–622). All antimicrobial classes identified in the review are classified as medically important. We estimate aggregate global human, terrestrial and aquatic food animal antimicrobial use in 2030 at 236,757 tons (95% UI 145,525–421,426), of which aquaculture constitutes 5.7% but carries the highest use intensity per kilogram of biomass (164.8 mg kg−1). This analysis calls for a substantial scale-up of surveillance capacities to monitor global trends in antimicrobial use. Current evidence, while subject to considerable uncertainties, suggests that for some species groups antimicrobial use intensity surpasses consumption levels in terrestrial animals and humans. Acknowledging the fast-growing nature of aquaculture as an important source of animal nutrition globally, our findings highlight the urgent need for enhanced antimicrobial stewardship in a high-growth industry with broad links to water and ecosystem health.","2020-12-14","2021-02-01 18:05:13","2021-02-01 18:05:43","2021-02-01 18:05:05","21878","","1","10","","Sci. Rep.","","","","","","","","en","2020 The Author(s)","","","","www.nature.com","","Number: 1 Publisher: Nature Publishing Group","","","","","","","","","","","","","","","","","","","","","","","","","","","","","","","","","","","","","","","","","","","","","","","","","","",""
"TRDNX9PC","journalArticle","2021","Forget, Yann; Shimoni, Michal; Gilbert, Marius; Linard, Catherine","Mapping 20 years of urban expansion in 45 urban areas of Sub-Saharan Africa","Remote Sensing","","","10.3390/rs13030525","https://www.mdpi.com/2072-4292/13/3/525","","2021-02-02","2021-02-02 11:31:55","2021-06-29 08:09:26","","","","3","13","","","","","","","","","","","","","","","","","","","","","mapping-human-population","","","","","","","","","","","","","","","","","","","","","","","","","","","","","","","","","","","","","","","","","","","","","","",""
"ZMRKUJW5","journalArticle","2021","Mignotte, Antoine; Garros, Claire; Dellicour, Simon; Jacquot, Maude; Gilbert, Marius; Gardès, Laetitia; Balenghien, Thomas; Duhayon, Maxime; Rakotoarivony, Ignace; de Wavrechin, Maïa; Huber, Karine","High dispersal capacity of Culicoides obsoletus (Diptera: Ceratopogonidae), vector of bluetongue and Schmallenberg viruses, revealed by landscape genetic analyses","Parasites and Vectors","","1756-3305","10.1186/s13071-020-04522-3","https://doi.org/10.1186/s13071-020-04522-3","In the last two decades, recurrent epizootics of bluetongue virus and Schmallenberg virus have been reported in the western Palearctic region. These viruses affect domestic cattle, sheep, goats and wild ruminants and are transmitted by native hematophagous midges of the genus Culicoides (Diptera: Ceratopogonidae). Culicoides dispersal is known to be stratified, i.e. due to a combination of dispersal processes occurring actively at short distances and passively or semi-actively at long distances, allowing individuals to jump hundreds of kilometers.","2021-02-03","2021-02-18 12:31:28","2021-06-29 08:11:22","2021-02-18 12:30:14","93","","1","14","","Parasit. Vectors","High dispersal capacity of Culicoides obsoletus (Diptera","","","","","","","","All rights reserved","","","","BioMed Central","","","","","","","Dispersal; Landscape genetics; Microsatellite; Culicoides obsoletus; Palearctic region","","","","","","","","","","","","","","","","","","","","","","","","","","","","","","","","","","","","","","","","","","","","","",""
"FXVU4KCT","journalArticle","2021","Dellicour, Simon; Hong, Samuel L.; Vrancken, Bram; Chaillon, Antoine; Gill, Mandev S.; Maurano, Matthew T.; Ramaswami, Sitharam; Zappile, Paul; Marier, Christian; Harkins, Gordon W.; Baele, Guy; Duerr, Ralf; Heguy, Adriana","Dispersal dynamics of SARS-CoV-2 lineages during the first epidemic wave in New York City","PLoS Pathogens","","1553-7374","10.1371/journal.ppat.1009571","https://journals.plos.org/plospathogens/article?id=10.1371/journal.ppat.1009571","During the first phase of the COVID-19 epidemic, New York City rapidly became the epicenter of the pandemic in the United States. While molecular phylogenetic analyses have previously highlighted multiple introductions and a period of cryptic community transmission within New York City, little is known about the circulation of SARS-CoV-2 within and among its boroughs. We here perform phylogeographic investigations to gain insights into the circulation of viral lineages during the first months of the New York City outbreak. Our analyses describe the dispersal dynamics of viral lineages at the state and city levels, illustrating that peripheral samples likely correspond to distinct dispersal events originating from the main metropolitan city areas. In line with the high prevalence recorded in this area, our results highlight the relatively important role of the borough of Queens as a transmission hub associated with higher local circulation and dispersal of viral lineages toward the surrounding boroughs.","2021","2021-05-26 10:17:26","2021-05-26 10:17:46","2021-05-26 10:17:26","e1009571","","5","17","","PLoS Path.","","","","","","","","en","","","","","PLoS Journals","","Publisher: Public Library of Science","","","","","Phylogeography; Phylogenetics; Phylogenetic analysis; Genomics; COVID 19; SARS CoV 2; Mutation detection; New York","","","","","","","","","","","","","","","","","","","","","","","","","","","","","","","","","","","","","","","","","","","","","",""
"K9P4GP4T","journalArticle","2021","Holbrook, Andrew J.; Lemey, Philippe; Baele, Guy; Dellicour, Simon; Brockmann, Dirk; Rambaut, Andrew; Suchard, Marc A.","Massive parallelization boosts big Bayesian multidimensional scaling","Journal of Computational and Graphical Statistics","","1061-8600","10.1080/10618600.2020.1754226","https://doi.org/10.1080/10618600.2020.1754226","Big Bayes is the computationally intensive co-application of big data and large, expressive Bayesian models for the analysis of complex phenomena in scientific inference and statistical learning. Standing as an example, Bayesian multidimensional scaling (MDS) can help scientists learn viral trajectories through space-time, but its computational burden prevents its wider use. Crucial MDS model calculations scale quadratically in the number of observations. We partially mitigate this limitation through massive parallelization using multi-core central processing units, instruction-level vectorization and graphics processing units (GPUs). Fitting the MDS model using Hamiltonian Monte Carlo, GPUs can deliver more than 100-fold speedups over serial calculations and thus extend Bayesian MDS to a big data setting. To illustrate, we employ Bayesian MDS to infer the rate at which different seasonal influenza virus subtypes use worldwide air traffic to spread around the globe. We examine 5392 viral sequences and their associated 14 million pairwise distances arising from the number of commercial airline seats per year between viral sampling locations. To adjust for shared evolutionary history of the viruses, we implement a phylogenetic extension to the MDS model and learn that subtype H3N2 spreads most effectively, consistent with its epidemic success relative to other seasonal influenza subtypes. Finally, we provide MassiveMDS, an open-source, stand-alone C++ library and rudimentary R package, and discuss program design and high-level implementation with an emphasis on important aspects of computing architecture that become relevant at scale.","2021-01-02","2021-05-26 10:13:08","2021-05-26 10:13:08","2021-05-26 09:51:52","11-24","","1","30","","","","","","","","","","","All rights reserved","","","","Taylor and Francis+NEJM","","Publisher: Taylor & Francis _eprint: https://doi.org/10.1080/10618600.2020.1754226","","","","","Bayesian phylogeography; Graphics processing unit; Hamiltonian Monte Carlo; Massive parallelization; multiple-data; Single-instruction","","","","","","","","","","","","","","","","","","","","","","","","","","","","","","","","","","","","","","","","","","","","","",""
