"QK28TDSJ","journalArticle","2018","Nicolas, Gaëlle; Tisseuil, Clément; Conte, Annamaria; Allepuz, Alberto; Pioz, Maryline; Lancelot, Renaud; Gilbert, Marius","Environmental heterogeneity and variations in the velocity of bluetongue virus spread in six European epidemics","Preventive Veterinary Medicine","","0167-5877","10.1016/j.prevetmed.2017.11.005","https://www.sciencedirect.com/science/article/pii/S0167587717304245","Several epidemics caused by different bluetongue virus (BTV) serotypes occurred in European ruminants since the early 2000. Studies on the spatial distribution of these vector-borne infections and the main vector species highlighted contrasted eco-climatic regions characterized by different dominant vector species. However, little work was done regarding the factors associated with the velocity of these epidemics. In this study, we aimed to quantify and compare the velocity of BTV epidemic that have affected different European countries under contrasted eco-climatic conditions and to relate these estimates to spatial factors such as temperature and host density. We used the thin plate spline regression interpolation method in combination with trend surface analysis to quantify the local velocity of different epidemics that have affected France (BTV-8 2007–2008, BTV-1 2008–2009), Italy (BTV-1 2014), Andalusia in Spain (BTV-1 2007) and the Balkans (BTV-4 2014). We found significant differences in the local velocity of BTV spread according to the country and epidemics, ranging from 7.9 km/week (BTV-1 2014 Italy) to 24.4 km/week (BTV-1 2008 France). We quantify and discuss the effect of temperature and local host density on this velocity.","2018-01-01","2017-11-13 08:12:53","2017-11-13 08:12:53","2017-11-13 08:12:53","1-9","","","149","","Preventive Veterinary Medicine","","","","","","","","","","","","","ScienceDirect","","","","","","","spatial epidemiology; Disease Vectors; Bluetongue; Spread rate","","","","","","","","","","","","","","","","","","","","","","","","","","","","","","","","","","","","","","","","","","","","","",""
"IPBF5GC7","journalArticle","2012","Maes, Sara S.; Machtelinckx, Thijs T.; de Clercq, Patrick P.; Moens, Maurice M.; Grégoire, Jean-Claude","The influence of acclimation, endosymbionts and diet on the supercooling capacity of the predatory bug Macrolophus pygmaeus","BioControl","","1386-6141","10.1007/s10526-012-9446-2","http://hdl.handle.net/2013/ULB-DIPOT:oai:dipot.ulb.ac.be:2013/183964","The generalist predator Macrolophus pygmaeus Rambur (Hemiptera: Miridae) is a key biological control agent in European greenhouses. The influence of acclimation, infection with endosymbiotic bacteria and diet on the cold tolerance of the Mediterranean biocontrol population was assessed by determining the supercooling point, i. e. the temperature at which the insect's body fluids freeze. This parameter provides a first indication of an insect's establishment potential in a new region and of its possible geographical range. Allowing the predatory bugs to adapt to lower temperatures resulted in an increase in supercooling ability. Macrolophus pygmaeus bugs exposed to antibiotics in their artificial diet and hence cured from their infection with the endosymbiotic bacteria Wolbachia pipientis, Rickettsia bellii and R. limoniae were more tolerant to freezing than infected bugs. The diet of the predators also affected the freezing temperature of the body fluids. Predators fed an artificial diet based on egg yolk were less resistant to freezing than those fed Ephestia kuehniella Zeller (Lepidoptera: Pyralidae) eggs. These findings illustrate that several factors may affect the cold hardiness of a biocontrol agent and may thus complicate the evaluation of its establishment potential in the framework of an environmental risk assessment. © 2012 International Organization for Biological Control (IOBC).","2012","2017-10-13 20:17:00","2021-07-02 11:22:51","","643-651","","5","57","","","","","","","","","","en","","","","","","","","","","","biological control; Entomologie; Environmental risk assessment; Sciences agronomiques; Cold hardiness; Heteroptera; Rickettsia; Wolbachia","","","","","","","","","","","","","","","","","","","","","","","","","","","","","","","","","","","","","","","","","","","","","","",""
"45FSGV6I","journalArticle","2014","Maes, Sara S.; Grégoire, Jean-Claude; de Clercq, Patrick P.","Prey range of the predatory ladybird Cryptolaemus montrouzieri","BioControl","","1386-6141","10.1007/s10526-014-9608-5","http://hdl.handle.net/2013/ULB-DIPOT:oai:dipot.ulb.ac.be:2013/218267","The prey range of Cryptolaemus montrouzieri was studied in the laboratory to investigate whether the mealybug destroyer can contribute to the suppression of other pest insects besides mealybugs and to assess its potential impact on non-mealybug populations as part of an environmental risk assessment for its use in biological control. Prey tested in these experiments were: tobacco aphid Myzus persicae nicotianae (Sulzer)(Hemiptera: Aphididae), pea aphid Acyrthosiphon pisum (Harris)(Hemiptera: Aphididae), tobacco whitefly Bemisia tabaci (Gennadius)(Hemiptera: Aleyrodidae), southern green stinkbug Nezara viridula (L.)(Hemiptera: Pentatomidae) eggs, western flower thrips Frankliniellaoccidentalis (Pergande)(Thysanoptera: Thripidae), two-spotted ladybird Adalia bipunctata (L.)(Coleoptera: Coccinellidae) eggs and eggs of the greater wax moth Galleria mellonella L. (Lepidoptera: Pyralidae). Larval survival was high to moderate when C. montrouzieri was provided with hemipteran prey and poor to zero when the ladybirds were provided with non-hemipteran prey. Females reared on M. persicae and A. pisum produced similar numbers of eggs as their counterparts fed the citrus mealybug Planococcus citri (Risso)(Hemiptera: Pseudococcidae), but fecundity was significantly lower when the ladybirds were reared on B. tabaci nymphs or on A. bipunctata eggs. Prey species that were found to be less suitable for immature development of C. montrouzieri could still be an adequate food source for reproduction and survival of adult ladybirds. For example, only 8 % of the predator larvae reached the adult stage when provided with A. bipunctata eggs, but females that had developed on eggs of the Mediterranean flour moth Ephestia kuehniella Zeller (Lepidoptera: Pyralidae) and that were supplied with A. bipunctata eggs from adult emergence on, were only 35 % less fecund than females provided with mealybugs in their adult life. The results are discussed in relation to the development of a suitable methodology for prey/host range testing in the framework of an environmental risk assessment for arthropod natural enemies.","2014","2017-10-13 20:17:00","2021-07-02 11:22:46","","729-738","","6","59","","","","","","","","","","en","","","","","","","","","","","Coleoptera; biological control; Coccinellidae; Entomologie; Environmental risk assessment; Sciences agronomiques; Non-native species; Predator; Prey range","","","","","","","","","","","","","","","","","","","","","","","","","","","","","","","","","","","","","","","","","","","","","","",""
"AFK4542D","journalArticle","2014","Maes, Sara S.; Antoons, Tim T.; de Clercq, Patrick P.; Grégoire, Jean-Claude","A semi-artificial rearing system for the specialist predatory ladybird Cryptolaemus montrouzieri","BioControl","","1386-6141","10.1007/s10526-014-9585-8","http://hdl.handle.net/2013/ULB-DIPOT:oai:dipot.ulb.ac.be:2013/184278","In the present study a semi-artificial rearing system for the Australian ladybird Cryptolaemusmontrouzieri Mulsant (Coleoptera: Coccinellidae), a specialist predator of mealybugs, was developed. In a first step, a rearing system using eggs of the Mediterranean flour moth Ephestia kuehniella Zeller (Lepidoptera: Pyralidae) as a food and synthetic polyester wadding as an oviposition substrate was compared with a natural rearing system using the citrus mealybug, Planococcus citri (Risso) (Hemiptera: Pseudococcidae), as to its effects on the predator’s developmental and reproductive parameters. In a second series of experiments the performance of C. montrouzieri on bee pollen or on a mixture of E.kuehniella eggs and bee pollen was assessed. E. kuehniella eggs proved to be a suitable food to support larval development of the predator. Ladybird larvae reared on flour moth eggs developed two days faster and weighed approximately 10 % more than their counterparts reared on mealybugs. Despite a prolongation of the preoviposition period with ca. eight days and a decrease in egg hatch by about 10 %, C. montrouzieri females fed moth eggs accepted the synthetic wadding as an oviposition substrate and deposited the same number of eggs their counterparts maintained on mealybugs. A mixture of E. kuehniella eggs with pollen yielded similar developmental and reproductive rates as E. kuehniella eggs alone, but a diet of bee pollen alone was not adequate for the predator. Our findings indicate the potential of a rearing system using E. kuehniella eggs as a factitious food and synthetic wadding as an artificial oviposition substrate for the mass production of C. montrouzieri.","2014","2017-10-13 20:17:00","2021-07-02 11:22:39","","557-564","","5","59","","","","","","","","","","en","","","","","","","","","","","Coleoptera; biological control; Coccinellidae; Entomologie; Sciences agronomiques; Artificial oviposition substrate; Factitious food; Rearing","","","","","","","","","","","","","","","","","","","","","","","","","","","","","","","","","","","","","","","","","","","","","","",""
"8RIXVRPX","journalArticle","2013","Verheyen, Kris; Ceunen; Ampoorter; Baeten, L.; Bosman; Branquart, E.; Carnol, Monique; De Wandeler; Grégoire, Jean-Claude; Lhoir; Muys, Bart; Nurlaya Setiawan; Vanhellemont; Ponette, Quentin","Assessment of the functional role of tree diversity: the multi-site FORBIO experiment","Plant Ecology and Evolution","","2032-3913","10.5091/plecevo.2013.803","http://hdl.handle.net/2013/ULB-DIPOT:oai:dipot.ulb.ac.be:2013/157768","Context - During the last two decades, functional biodiversity research has provided strong support for the hypothesis that more biodiverse ecosystems have the potential to deliver more and better services. However, most empirical support for this hypothesis comes from simple structured communities that are relatively easy to manipulate. The impact of forest biodiversity on forest ecosystem functioning has been far less studied. Experiment design - In this paper, we present the recently established, large-scale FORBIO experiment (FORest BIOdiversity and Ecosystem Functioning), specifically designed to test the effects of tree species diversity on forest ecosystem functioning. FORBIO's design matches with that of the few other tree diversity experiments worldwide, but at the same time, the FORBIO experiment is unique as it consists of a similar experimental set-up at three sites in Belgium (Zedelgem, Hechtel-Eksel and Gedinne) with contrasting edaphic and climatological characteristics. This design will help to provide answers to one of the most interesting unresolved questions in functional biodiversity research, notably whether the effects of complementarity on ecosystem functioning decrease in less stressful and more productive environments. At each site, FORBIO consists of 41 to 44 plots (127 plots in total) planted with monocultures and mixtures up to four species, selected from a pool of five site-adapted, functionally different tree species. When allocating the treatments to the plots, we maximally avoided any possible covariation between environmental factors. Monitoring of ecosystem functioning already started at the Zedelgem and Gedinne sites and will start soon in Hechtel-Eksel. Multiple processes are being measured and as the trees grow older, we plan to add even more processes. Expected results - Not only basic science, but also forest management will benefit from the results coming from the FORBIO experiment, as FORBIO is, for instance, also a test case for uncommon, not well-known tree species mixtures. To conclude, FORBIO is an important ecosystem experiment that has the potential to deliver badly needed insights into the multiple relationships between biodiversity and ecosystem functioning, which will be valuable for both science and practice. © 2013 National Botanic Garden of Belgium and Royal Botanical Society of Belgium.","2013","2017-10-13 20:17:00","2021-06-29 08:15:53","","1-10","","1","146","","","","","","","","","","en","","","","","","","","","","","Ecologie; Sylviculture; Biodiversity-ecosystem functioning research; Field experiment; Forest ecology; Forest management; Mixed forest; Tree diversity","","","","","","","","","","","","","","","","","","","","","","","","","","","","","","","","","","","","","","","","","","","","","","",""
"EFFGIAZV","journalArticle","2017","Marini, Lorenzo; Okland, Bjørn; Jönsson; Bentz, Barbara J.; Carroll, Allan; Forster, Beat; Grégoire, Jean-Claude; Hurling; Nageleisen, Louis-Michel; Netherer; Ravn, Hans Peter H.P.; Weed, Aaron; Schroeder, Martin L.","Climate drivers of bark beetle outbreak dynamics in Norway spruce forests","Ecography","","0906-7590","10.1111/ecog.02769","http://hdl.handle.net/2013/ULB-DIPOT:oai:dipot.ulb.ac.be:2013/258736","","2017","2017-10-13 20:17:00","2017-10-13 20:17:00","","","","","","","","","","","","","","","fr","","","","","","","","","","","Entomologie; Ecologie; Ecologie [animale]; Phytoparasitologie et phytopathologie; Sciences bio-médicales et agricoles","","","","","","","","","","","","","","","","","","","","","","","","","","","","","","","","","","","","","","","","","","","","","","",""
"779SDZEW","journalArticle","2012","Gryspeirt, Aiko; Grégoire, Jean-Claude","Effects of two varieties of Bacillus thuringiensis maize on the biology of Plodia interpunctella","Toxins","","0142-8535","10.3390/toxins4050373","http://hdl.handle.net/2013/ULB-DIPOT:oai:dipot.ulb.ac.be:2013/123084","On the market since 1996, genetically modified plants expressing an insecticidal toxin (Cry toxin stemmed from Bacillus thuringiensis) target several lepidopteran and coleopteran pests. In this study, we assessed the impact of two varieties of Bt maize producing different toxins (Cry1Ab or Cry1Fa, respectively) on the biology of a storage pest: Plodia interpunctella (Hübner) (Lepidoptera: Pyralidae). The Indianmeal moths were susceptible to both toxins but showed an escape behavior only from Cry1Fa. The weight of females issued from larvae reared on Cry1Ab increased with increasing toxin concentration, but adults of both sexes reared on Cry1Fa had decreased weight. Both toxins increased development time from egg to adult regardless of sex and had no impact on the male adult lifespan. Finally, we recorded a time lag between metamorphosis from the non-Bt and the Bt diets, which increased proportionally to Cry concentration in the Bt diet. © 2012 by the authors; licensee MDPI, Basel, Switzerland.","2012","2017-10-13 20:17:00","2021-07-02 11:19:38","","373-389","","","4","","","","","","","","","","en","","","","","","","","","","","Ecologie","","","","","","","","","","","","","","","","","","","","","","","","","","","","","","","","","","","","","","","","","","","","","","",""
"8EN9S83R","journalArticle","2010","La Spina, Sylvie; Grégoire, Jean-Claude; Mertens, Patrick; De Cannière, Charles","Impact of poplar water status on leaf-beetle (Chrysomela populi) survival and feeding","Annals of Forest Science","","1286-4560","10.1051/forest/2009102","http://hdl.handle.net/2013/ULB-DIPOT:oai:dipot.ulb.ac.be:2013/98408","The aim of this study is to assess the impact of drought on insect-tree relationships. Survival and feeding performances of leaf-beetles, Chrysomela populi put in cages with leaves of host-plants submitted to different levels of water stress were compared. Ninety 1-year-old poplar (Populus × euramericana) cuttings were grown in a greenhouse, and distributed into 3 groups submitted to different water treatments during six weeks. Adult C. populi were then encaged for four days with these cuttings, together with the five terminal leaves of a twig. Beetle survival and consumed leaf areas were then determined. Predawn leaf water potential values indicated that the drought treatments induced different levels of plant water stress. Plant height growth and total leaf numbers were reduced by plant stress. Beetle survival and leaf areas eaten were also reduced proportionally to plant water deficit. In conclusion, this experiment suggests that drought has a negative impact on C. populi survival and feeding. © INRA, EDP Sciences, 2010.","2010","2017-10-13 20:17:00","2021-07-02 11:21:45","","209-214","","","67","","","","","","","","","","en","","","","","","","","","","","Entomologie; Ecologie; Ecologie [animale]; Phytoparasitologie et phytopathologie; Sylviculture; Agronomie générale; Drought stress; Ecologie chimique; herbivory; Populus; Tree-insect relationships; Water deficit","","","","","","","","","","","","","","","","","","","","","","","","","","","","","","","","","","","","","","","","","","","","","","",""
"VCIEGWI4","journalArticle","2011","Kirichenko, Natalia; Flament, Julie; Baranchikov, Y.; Grégoire, Jean-Claude","Larval performances, heterogeneous development and life cycle completion of the Siberian moth, Dendrolimus sibiricus (Lepidoptera: Lasiocampidae) on potential host plants in Europe: a laboratory study on potted trees","European Journal of Forest Research","","1612-4669","","http://hdl.handle.net/2013/ULB-DIPOT:oai:dipot.ulb.ac.be:2013/98406","","2011","2017-10-13 20:17:00","2021-07-02 11:21:13","","","","","","","","","","","","","","","en","","","","","","","","","","","Entomologie; Ecologie; Ecologie [animale]; Phytoparasitologie et phytopathologie; Sylviculture; Agronomie générale; Ecologie chimique","","","","","","","","","","","","","","","","","","","","","","","","","","","","","","","","","","","","","","","","","","","","","","",""
"33MMBCUC","journalArticle","2011","Hautier, Louis; San Martin Y Gomez, Gilles; Callier, P.; de Biseau D'Hauteville, Jean-Christophe; Grégoire, Jean-Claude","Alkaloids provide evidence of intraguild predation on native coccinellids by Harmonia axyridis in the field","Biological Invasions","","1387-3547","10.1007/s10530-010-9935-0","http://hdl.handle.net/2013/ULB-DIPOT:oai:dipot.ulb.ac.be:2013/98407","Over a period of less than 5 years, Belgium was thoroughly invaded by the multicolored Asian coccinellid, Harmonia axyridis. At the same time, a decline of some native coccinellid species was observed in tree habitats. One hypothesis about the cause of this decline was that it might have been due to intraguild predation (IGP) by H. axyridis. In natural conditions, IGP between coccinellids can be tracked by using defensive compounds. Exogenous alkaloids in H. axyridis were therefore examined by gas chromatography-mass spectrometry (GC–MS), using individuals sampled from lime trees that were also occupied by other species of coccinellids. Harmonia axyridis was the dominant species at all life stages, in terms of both numbers of sites occupied and local abundance. The GC–MS analysis of H. axyridis larvae revealed traces of exogenous alkaloids from 19 of the 20 sites and, in nine of those 19 sites, more than 30% of the larvae analyzed contained exogenous alkaloids. Three alkaloids were detected: adaline from Adalia spp., calvine from Calvia spp. and propyleine from Propylea quatuordecimpunctata. Predation by H. axyridis on two different coccinellid species was also detected in the same larva, reinforcing the status of H. axyridis as a top predator. A generalized linear model indicated that IGP frequency was positively influenced by two variables: the abundance of extraguild and intraguild prey; and the interaction between these two variables. Our results therefore support the hypothesis that IGP by H. axyridis on native coccinellids in tree habitats has led to the decline of several of these species.","2011","2017-10-13 20:17:00","2021-07-02 11:19:53","","1805-1814","","","13","","","","","","","","","","en","","","","","","","","","","","Entomologie; Ecologie; Ecologie [animale]; Phytoparasitologie et phytopathologie; Sylviculture; Agronomie générale; Ecologie chimique; Alkaloids, Biological control, Biological invasions, Ladybirds, G","","","","","","","","","","","","","","","","","","","","","","","","","","","","","","","","","","","","","","","","","","","","","","",""
"CW3RPPEV","journalArticle","2015","Eschen, René R.; Rigaux, Ludovic; Sukovata, Lidia L.; Vettraino, Anna Maria A.M.; Marzano, Mariella M.; Grégoire, Jean-Claude","Phytosanitary inspection of woody plants for planting at european union entry points: A practical enquiry","Biological Invasions","","1387-3547","10.1007/s10530-015-0883-6","http://hdl.handle.net/2013/ULB-DIPOT:oai:dipot.ulb.ac.be:2013/220713","Phytosanitary import inspections are important to avoid entry of harmful pests on live plants. In the European Union (EU), all consignments of live plants must be inspected at the first point of entry, and plants allowed entry can be moved without further inspection among the 28 Member States and Switzerland. It is important that inspections in EU countries adhere to the same standard to avoid introduction of harmful organisms through countries with weaker methods. We tested whether sampling intensity and confidence in the inspection results were the same across these countries. Questionnaires were sent to inspectors in all countries, asking about inspections of individual consignments of woody plants for planting. Data about 102 lots, inspected at 13 points of entry in six countries, were analyzed. We used hypergeometric and binomial statistics for small and large consignments, respectively, to calculate the probability that <1 % of the plants were infested. The duration of the inspection increased with lot size, but the probability that the infestation level was below 1 % of the plants was lower for small than for large lots. Moreover, large international differences in inspection intensity and the probability that the inspections could detect a level of infestation below 1 % were found: the probability was consistently above 0.95 in one country, while the average probability was below 0.6 in the other countries. We suggest that the EU Member States adopt common maximum acceptable infestation levels and harmonized, statistics-based sampling protocols for plants for planting.","2015","2017-10-13 20:17:00","2021-06-29 08:14:39","","2403-2413","","8","17","","","","","","","","","","en","","","","","","","","","","","European Union; Ecologie; international trade; Evolution des espèces; International standards for phytosanitary measures (ISPM); Invasive alien species; Phytosanitary inspections; Quarantine species","","","","","","","","","","","","","","","","","","","","","","","","","","","","","","","","","","","","","","","","","","","","","","",""
"LFNNE9SA","journalArticle","2018","Nicolas, Gaëlle; Apolloni, Andrea; Coste, Caroline; Wint, G. R. William; Lancelot, Renaud; Gilbert, Marius","Predictive gravity models of livestock mobility in Mauritania: The effects of supply, demand and cultural factors","PLoS One","","1932-6203","10.1371/journal.pone.0199547","http://journals.plos.org/plosone/article?id=10.1371/journal.pone.0199547","Animal movements are typically driven by areas of supply and demand for animal products and by the seasonality of production and demand. As animals can potentially spread infectious diseases, disease prevention can benefit from a better understanding of the factors influencing movements patterns in space and time. In Mauritania, an important cultural event, called the Tabaski (Aïd el Kebir) strongly affects timing and structure of movements, and due to the arid and semi-arid climatic conditions, the season can also influence movement patterns. In order to better characterize the animal movements patterns, a survey was carried out in 2014, and those data were analysed here using social network analysis (SNA) metrics and used to train predictive gravity models. More specifically, we aimed to contrast the movements structure by ruminant species, season (Tabaski vs. Non-Tabaski) and mode of transport (truck vs. foot). The networks differed according to the species, and to the season, with a changed proportion of truck vs. foot movements. The gravity models were able to predict the probability of a movement link between two locations with moderate to good accuracy (AUC ranging from 0.76 to 0.97), according to species, seasons, and mode of transport, but we failed to predict the traded volume of those trade links. The significant predictor variables of a movement link were the human and sheep population at the source and origin, and the distance separating the locations. Though some improvements would be needed to predict traded volumes and better account for the barriers to mobility, the results provide useful predictions to inform epidemiological models in space and time, and, upon external validation, could be useful to predict movements at a larger regional scale.","2018-07-18","2018-07-20 08:01:40","2021-06-29 07:33:36","2018-07-20 08:01:40","e0199547","","7","13","","PLoS One","Predictive gravity models of livestock mobility in Mauritania","","","","","","","en","","","","","PLoS Journals","","","","","","mapping-livestock; livestock-disease-mapping","Cattle; Livestock; Veterinary diseases; Camels; Sheep; Centrality; Mauritania; Ruminants","","","","","","","","","","","","","","","","","","","","","","","","","","","","","","","","","","","","","","","","","","","","","",""
