"Key","Item Type","Publication Year","Author","Title","Publication Title","ISBN","ISSN","DOI","Url","Abstract Note","Date","Date Added","Date Modified","Access Date","Pages","Num Pages","Issue","Volume","Number Of Volumes","Journal Abbreviation","Short Title","Series","Series Number","Series Text","Series Title","Publisher","Place","Language","Rights","Type","Archive","Archive Location","Library Catalog","Call Number","Extra","Notes","File Attachments","Link Attachments","Manual Tags","Automatic Tags","Editor","Series Editor","Translator","Contributor","Attorney Agent","Book Author","Cast Member","Commenter","Composer","Cosponsor","Counsel","Interviewer","Producer","Recipient","Reviewed Author","Scriptwriter","Words By","Guest","Number","Edition","Running Time","Scale","Medium","Artwork Size","Filing Date","Application Number","Assignee","Issuing Authority","Country","Meeting Name","Conference Name","Court","References","Reporter","Legal Status","Priority Numbers","Programming Language","Version","System","Code","Code Number","Section","Session","Committee","History","Legislative Body"
"BEHQDNA7","thesis","2006","Bonato, Pierre","Suivi de populations endémiques d’Ips typographus (Coleoptera : Scolytidae) en Région Wallonne à l’aide d’un réseau de pièges à phéromones","","","","","","","2006","2016-11-09 19:18:01","2016-11-09 19:18:20","","","","","","","","","","","","","Université Libre de Bruxelles","","","","MSc","","","","","","","","","","","","","","","","","","","","","","","","","","","","","","","","","","","","","","","","","","","","","","","","","","","","","","","",""
"83S7PD58","thesis","2006","Lévy, Yair","Un modèle spatial et temporel des populations d’Ips typographus en phase d’épidémie","","","","","","","2006","2016-11-09 19:17:22","2016-11-09 19:17:43","","","","","","","","","","","","","Université Libre de Bruxelles","","","","MSc","","","","","","","","","","","","","","","","","","","","","","","","","","","","","","","","","","","","","","","","","","","","","","","","","","","","","","","",""
"THT9NH9D","thesis","2008","Pirard, Audrey","La propagation de la grippe aviaire en relation avec la géographie économique de la filière avicole","","","","","","","2008","2016-11-09 19:16:32","2016-11-09 19:16:57","","","","","","","","","","","","","Université Libre de Bruxelles","","","","MSc","","","","","","","","","","","","","","","","","","","","","","","","","","","","","","","","","","","","","","","","","","","","","","","","","","","","","","","",""
"QWNDK4CA","thesis","2008","Sotiaux, Alix","Identification des déterminants paysagers de la distribution spatiale de Culicoides imicola: analyse exploratoire","","","","","","","2008","2016-11-09 19:16:01","2016-11-09 19:16:20","","","","","","","","","","","","","Université Libre de Bruxelles","","","","MSc","","","","","","","","","","","","","","","","","","","","","","","","","","","","","","","","","","","","","","","","","","","","","","","","","","","","","","","",""
"UWHQI3TG","thesis","2009","Desphande, Savitri","Epidémiologie spatiale des défoliateurs des chênes en France sur base de dispositifs de surveillance entomologique","","","","","","","2009","2016-11-09 19:15:30","2016-11-09 19:15:50","","","","","","","","","","","","","Université Libre de Bruxelles","","","","MSc","","","","","","","/Users/simondellicour/Dropbox/Simon_repos/Files/Zotero/storage/RSSZ7ATI/Desphande - 2009 - Epidémiologie spatiale des défoliateurs des chênes.pdf","","","","","","","","","","","","","","","","","","","","","","","","","","","","","","","","","","","","","","","","","","","","","","","","",""
"M66C2DU9","thesis","2009","Seghouane, Fatima","Analyse de la distribution du genre Culicoides, vecteur de la fièvre catarrhale ovine à l’échelle du paysage","","","","","","","2009","2016-11-09 19:14:41","2016-11-09 19:15:18","","","","","","","","","","","","","Université d’Orléans","","","","MSc","","","","","","","","","","","","","","","","","","","","","","","","","","","","","","","","","","","","","","","","","","","","","","","","","","","","","","","",""
"7RDFIR57","thesis","2009","Vercauteren Drubbel, Maëlle","Distribution des adultes du genre Culicoides, vecteurs de la fièvre catarrhale ovine, au sein de l'exploitation","","","","","","","2009","2016-11-09 19:13:22","2016-11-09 19:13:46","","","","","","","","","","","","","Université Libre de Bruxelles","","","","MSc","","","","","","","","","","","","","","","","","","","","","","","","","","","","","","","","","","","","","","","","","","","","","","","","","","","","","","","",""
"2A24DQUX","thesis","2010","Simar, Valentine","Caractérisation de la présence du marsouin commun (Phocoena phocoena) en baie sude de la Mer du Nord et Manche Orientale","","","","","","","2010","2016-11-09 19:12:31","2016-11-09 19:13:02","","","","","","","","","","","","","Université Libre de Bruxelles","","","","MSc","","","","","","","/Users/simondellicour/Dropbox/Simon_repos/Files/Zotero/storage/T947BUNP/Simar - 2010 - Caractérisation de la présence du marsouin commun .pdf","","","","","","","","","","","","","","","","","","","","","","","","","","","","","","","","","","","","","","","","","","","","","","","","",""
"SBS2UE7H","thesis","2009","Van Boeckel, Thomas P.","Modélisation de la distribution géographique du canard domestique (Anas platyrhynchos) : approche statistique et multi-critères","","","","","","","2009","2016-11-09 19:11:37","2016-11-09 19:12:01","","","","","","","","","","","","","Université Libre de Bruxelles","","","","MSc","","","","","","","","","","","","","","","","","","","","","","","","","","","","","","","","","","","","","","","","","","","","","","","","","","","","","","","",""
"S6A7FG38","thesis","2013","Claes, Fanny","Evaluation et cartographie du risque d’influenza aviaire, à l’aide de la télédétection, dans la province de Tananarive à Madagascar","","","","","","","2013","2016-11-09 19:10:48","2016-11-09 19:11:18","","","","","","","","","","","","","Université Libre de Bruxelles","","","","MSc","","","","","","","","","","","","","","","","","","","","","","","","","","","","","","","","","","","","","","","","","","","","","","","","","","","","","","","",""
"Q5975RNB","thesis","2014","Chaiban, Celia","Analyse de la distribution géographique des différents clades d’influenza A H5N1 dans la région du Mékong","","","","","","","2014","2016-11-09 19:09:55","2016-11-09 19:10:24","","","","","","","","","","","","","Université Libre de Bruxelles","","","","MSc","","","","","","","","","","","","","","","","","","","","","","","","","","","","","","","","","","","","","","","","","","","","","","","","","","","","","","","",""
"U9H9K534","thesis","2014","Michel, Colin","Modélisation spatio-temporelle de l'invasion de la France par la mineuse du marronnier Cameraria ohridella: nouvelles approches méthodologiques","","","","","","","2014","2016-11-09 19:09:12","2016-11-09 19:09:38","","","","","","","","","","","","","Université Libre de Bruxelles","","","","MSc","","","","","","","","","","","","","","","","","","","","","","","","","","","","","","","","","","","","","","","","","","","","","","","","","","","","","","","",""
"AHJG98C2","thesis","2014","Duchatel, Florian","Développement d'un modèle multi-agents pour l'étude de la distribution spatio-temporelle du risque de transmission de la grippe aviaire autour du lac Poyang (Chine)","","","","","","","2014","2016-11-09 19:07:43","2016-11-09 19:08:16","","","","","","","","","","","","","Université Libre de Bruxelles","","","","MSc","","","","","","","","","","","","","","","","","","","","","","","","","","","","","","","","","","","","","","","","","","","","","","","","","","","","","","","",""
"MHV8PI23","thesis","2016","Allaert, Michael","Utilisation de données de téléphonie mobile pour l’évaluation de l’exposition à l’hantavirus en Belgique.","","","","","","","2016","2016-10-18 16:59:29","2016-10-18 17:06:28","","","","","","","","","","","","","ULB","","","","MSc","","","","","","","/Users/simondellicour/Dropbox/Simon_repos/Files/Zotero/storage/ZZK69NJ3/Allaert - 2016 - Utilisation de données de téléphonie mobile pour l.pdf","","","","","","","","","","","","","","","","","","","","","","","","","","","","","","","","","","","","","","","","","","","","","","","","",""
"VVBSU3ST","thesis","2016","Boucart, Jérémie","Analyse spatio-temporelle des flux commerciaux internationaux d’animaux d’élevage","","","","","","","2016","2016-10-18 17:05:43","2016-10-18 17:06:18","","","","","","","","","","","","","ULB","","","","MSc","","","","","","","/Users/simondellicour/Dropbox/Simon_repos/Files/Zotero/storage/PHTDRUE7/Boucart - 2016 - Analyse spatio-temporelle des flux commerciaux int.pdf","","","","","","","","","","","","","","","","","","","","","","","","","","","","","","","","","","","","","","","","","","","","","","","","",""
"R58H7Q62","thesis","2015","Romero-Pinazo, Lola","Modélisation spatiale prédictive de trois espèces hôtes sauvages de l’influenza aviaire en Europe et en Asie à partir de données d’occurrences européennes","","","","","","","2015","2017-06-16 12:54:05","2021-07-03 09:19:47","","","","","","","","","","","","","","","","","MSc","","","","","","","/Users/simondellicour/Dropbox/Simon_repos/Files/Zotero/storage/AXMU6GMQ/Romero-Pinazo - 2015 - Modélisation spatiale prédictive de trois espèces .pdf","","","","","","","","","","","","","","","","","","","","","","","","","","","","","","","","","","","","","","","","","","","","","","","","",""
"H3WEB4PV","thesis","2018","Verheyden, Lisa","Analyse spatiale de l'association entre riziculture et élevages de canards domestiques de l'Asie du sud-est","","","","","","","2018","2018-08-23 14:55:17","2021-07-03 09:19:57","","","","","","","","","","","","","","","","","MSc","","","","","","","/Users/simondellicour/Dropbox/Simon_repos/Files/Zotero/storage/EIXK7KDJ/Verheyden - 2018 - Analyse spatiale de l'association entre rizicultur.pdf","","","","","","","","","","","","","","","","","","","","","","","","","","","","","","","","","","","","","","","","","","","","","","","","",""
"5K3PCRIE","thesis","2018","Boustani, Zackaria","Modélisation des flux migratoires de palmipèdes:Mise en évidence des interfaces aviaires à risque d’influenza à partir de données d’occurrences asiatiques","","","","","","","2018","2018-08-23 14:52:29","2021-07-03 09:19:55","","","","","","","","","","","","","","","","","MSc","","","","","","","/Users/simondellicour/Dropbox/Simon_repos/Files/Zotero/storage/L7EJ6KEU/Boustani - 2018 - Modélisation des flux migratoires de palmipèdesMi.pdf","","","","","","","","","","","","","","","","","","","","","","","","","","","","","","","","","","","","","","","","","","","","","","","","",""
"XRIF3Z44","thesis","2018","Babin, Léon","Étude et Modélisation de la distribution de Monochamus spp. dans les forêts de pins en Europe","","","","","","","2018","2018-08-23 14:51:10","2021-07-03 09:19:52","","","","","","","","","","","","","","","","","MSc","","","","","","","/Users/simondellicour/Dropbox/Simon_repos/Files/Zotero/storage/TWPJ2NSA/Babin - 2018 - Étude et Modélisation de la distribution de Monoch.pdf","","","","","","","","","","","","","","","","","","","","","","","","","","","","","","","","","","","","","","","","","","","","","","","","",""